reviewId,userName,userImage,content,score,thumbsUpCount,reviewCreatedVersion,at,replyContent,repliedAt,appVersion
8cc9d95f-61d6-45cd-83ec-4b0310636dda,Jose Tilman,https://play-lh.googleusercontent.com/a/ACg8ocLZtyUIZkrN8ShgECNZJmflvcTVMBIIhQQkMySZnrSWlvr8=mo,Saya hnya ksih rating 1 krna pas saya buka untuk mendaftar tapi gak bisa apply nia langsung keluar saja mohon perbaiki yaa😨🙏 sya sudah dua kali copot apply nya pas mau daftar langsung keluar aja mohon perbaiki 😤😨🙏,1,4,,2024-01-24 13:41:53,,,
1a2fb5ad-eb8f-4827-b714-8632000f7152,Gea Prima,https://play-lh.googleusercontent.com/a-/ALV-UjUiVMJkmO97zSp0xsbYfWaICKsi3q__zGw10f_fi_WYfexX0t0b,"Tik tok tolong update buat filter urut , apabila music di klik , jadi kami bisa melihat mana video dari music tersebut yang baru",4,913,26.1.3,2022-09-15 06:25:12,,,26.1.3
5474e122-d78a-437e-9684-1ff03b2c1f7e,Pengguna Google,https://play-lh.googleusercontent.com/EGemoI2NTXmTsBVtJqk8jxF9rh8ApRWfsIMQSt2uE4OcpQqbFu7f7NbTK05lx80nuSijCz7sc3a277R67g,"saya kasih bintang 3 aja,,,barang kali tik tok nya eror,,tiktok terkadang ada gangguan,klo tiktok nya lancar gx ada gangguan nanti saya kasih bintang lebih dri 5 hiiii😁",3,21,,2019-10-07 09:10:42,,,
978c4aa4-9b0b-4571-9e9a-566e0d1a20f9,IRHAM BIN ZAINUDIN,https://play-lh.googleusercontent.com/a-/ALV-UjUjv1IFU-DFtpPZ7InQLK_dX6A1YOKdDqJuoo-dJ35KudVa3No5,"Makasih sudah memberikan aku aplikasi sanget bagus,karena aplikasi tiktok ini jadi gk terasa kesepian lagi,banyak teman"" tempat berbagi cerita yg sangat menarik,aku selalu kasih yg terbaik dengn bintang 5👍🏻",5,1444,31.3.4,2023-09-20 19:19:35,,,31.3.4
c3050231-ad8c-4aeb-a227-a3d478b6fa98,Erno 07,https://play-lh.googleusercontent.com/a/ACg8ocKY6x3zGIdKlbV6UUhMuLhsiXSq0-fLNwJk9bTYY2YEtjQiZg=mo,Terima kasih tiktok Sangat sangat membantu,5,3,34.0.3,2024-04-02 16:33:50,,,34.0.3
a8d6216e-6d47-446b-a8a8-853a96f4c7f6,Pengguna Google,https://play-lh.googleusercontent.com/EGemoI2NTXmTsBVtJqk8jxF9rh8ApRWfsIMQSt2uE4OcpQqbFu7f7NbTK05lx80nuSijCz7sc3a277R67g,Pertamanya aku heran kenapa ada 2 tik tok padahal aku udh download tiktok yg satunya lagi..nah aku coba download yg ini ternyata ini itu apli musicaly yang udh dibeli sama tiktok...makasih banget karena aku skrng bisa ngehapusin aib aib aku,5,514,13.8.4,2019-11-19 14:37:39,,,13.8.4
88d652f3-6a4d-4bc5-bce2-523ca5809a05,Meta Meta,https://play-lh.googleusercontent.com/a-/ALV-UjW_ghy3I0_sCo3pRkWBfaE_2TadyLmGeZnshY0Vik6f48w4IzHyjg,"Mengapa aplikasi saya tidak bisa melangsungkan live, padahal umur saya sudah melampaui lebih dari 20 tahun, dan sampai sekarang pengikut saya pun sudah lebih dari 1000, tolong untuk aplikasi tiktok membuka akun saya agar say bisa membuat live.",2,994,26.7.5,2022-11-08 09:21:47,,,26.7.5
307c24c1-0529-4710-b3be-fe8c8055da58,Pengguna Google,https://play-lh.googleusercontent.com/EGemoI2NTXmTsBVtJqk8jxF9rh8ApRWfsIMQSt2uE4OcpQqbFu7f7NbTK05lx80nuSijCz7sc3a277R67g,"Aq suka sama aplikasi ini. Cuman yang bikin kesell kalo ga di buka setiap hari berandanya jadi acak""an tolong lebih di kondisikan lagi ya min",5,796,15.4.2,2020-03-25 06:49:22,,,15.4.2
9fb42e1f-d1b1-4d42-9a05-be3291203fed,Nisa Salman,https://play-lh.googleusercontent.com/a-/ALV-UjUj1OVkcCbmguY6AP_H89EMIFTPVHI4yWjJAghmLp_jqy9r0unj,"Ak kecewa ama admin tiktok ,kenapa comenan orang yg menjelekkan presiden di loloskan sedangkan comen yg berkaitan dengan anis selalu di hapus,jadi admin it harus lelogo kelihatan bnget admin pendukung anis,maaf klau kata"" ku kurang sopan 🙏kecewa ja gtu",1,3,34.3.3,2024-04-16 23:16:57,,,34.3.3
948bde4f-dade-40a7-ad48-17f565864cd5,Aqshal Fath,https://play-lh.googleusercontent.com/a-/ALV-UjVanyJ7jhnGHigyUa1urb5gUaKOOvwI4mdtRc5-FnZixL21xUfm,"Terimakasih aplikasinya bagus banget bikin wawasanku tambah luas. Dari tiktok kita bisa belajar mana yang benar dan mana yang salah, tapi tergantung fyp sih",5,925,23.5.3,2022-03-15 11:59:12,,,23.5.3
0949a434-a00a-4893-991f-d305f518a860,Raisa Story,https://play-lh.googleusercontent.com/a/ACg8ocLVYhFZiGP5jn31z8QK9Hwp6TJgPXWprnbMSFdG0HfekZ7f-hVl=mo,"Dear tiktok. Saya suka sekali dengan aplikasinya, namun ada 1 yang kurang. Yaitu fitur menamai dan mengkategorikan vidio yang di save. Agar pengguna lebih mudah mensave vidio yang bermanfaat. Terima kasih. Saya harap ulasan saya dibaca dan fitur ini siap di luncurkan.",4,106,,2021-04-10 11:57:41,,,
c6a386ab-0298-48c9-bc25-bac7f809e270,Pengguna Google,https://play-lh.googleusercontent.com/EGemoI2NTXmTsBVtJqk8jxF9rh8ApRWfsIMQSt2uE4OcpQqbFu7f7NbTK05lx80nuSijCz7sc3a277R67g,Suka banget sama app ini. Karna bisa menghibur di saat mood kumatt wkwk ❤ tp knpa kalau setiap klik lagu nya suka error yaaah,5,13,,2019-12-04 07:34:09,,,
7deedf5e-7a54-41aa-b0f5-f8b4216fbbb6,Suhaendi Hendi,https://play-lh.googleusercontent.com/a-/ALV-UjV08suhf6VVeiFKHr9q_Vhzl8lAqXRP700yVMCWNld03F2wMz9L,Aku tidak bisa berkata apa pun... karna aplikasi ini sangat bagus dan cocok untuk ku aku sangatt suka dan aku akan beri aplikasi ini 5 bintang jika ada bintang 6 aku akan kasih aplikasi ini bintang enam dan satu hal lagi.. bagi kamu yang baca ini kamu ga akan nyesel jika download aplikasi seru ini .. aku jamin 100% kamu ga akan nyesel.,5,11,,2020-10-24 10:24:11,,,
9a0f481d-a391-454e-abe1-ffd74cea3c1f,Eufragia Sousa,https://play-lh.googleusercontent.com/a/ACg8ocJUW8DPjcMpMWekhDheQPRbDX3ojF-Ajf0ehWE-_6RfpL_CIw=mo,Apknya sangat membosankan.. Knp saat saya buka apknya selalu tidak bisa dan selalu keterangan tidak ada koneksi internet padahal jaringan saya stabil 🥵🥵,1,365,29.6.4,2023-06-22 21:49:08,,,29.6.4
62265252-3506-450e-bbe2-706998be4213,Mmh Rizki,https://play-lh.googleusercontent.com/a/ACg8ocJKtEzmA86DopZ3iURaHtjeB2QmlECVFwSvFfYQ5e1OzOQAYQ=mo,Tolong bantu tiktok ga bisa ke buka lupa kata sandi Imel ga aktip,5,5,33.8.5,2024-03-15 02:28:54,,,33.8.5
8d3e5db8-9515-4117-b8ce-6ec5b20441a2,Nyai Siti Fatimah,https://play-lh.googleusercontent.com/a/ACg8ocKfPm_IBDmUdqNqClVgX4nFMsisuqPZLWCLHeQhenHrUP0spQ=mo,Keren abis mantap dah,5,4,34.0.3,2024-03-26 10:58:15,,,34.0.3
b20fd1c6-5238-4f8d-a7cc-e4fbbe0efcdf,yuli sabila,https://play-lh.googleusercontent.com/a/ACg8ocKIZgE6FKvHE19LjdoG_GEVrxOqZ3JJ0C8tpWdS6huFxDyiBQ=mo,kurang suka sama admin nya knpa kata2 kasar yg mnjatuhkan presiden sllu lolos,1,4,34.1.5,2024-04-05 18:14:56,,,34.1.5
0b1fdb04-633d-4a23-a14a-8842ce631623,Dhani Orlando,https://play-lh.googleusercontent.com/a-/ALV-UjXJDqS8bdmLX21aWw8SA7CKhaQ8BaxjKmfm18VKTJR3GXTfnnM,Tidak puas karena postingan selalu dihapus,1,3,34.2.3,2024-04-10 21:35:17,,,34.2.3
c8bbe27c-75c1-48e6-b883-334f7c78ba61,Nenk Ammara,https://play-lh.googleusercontent.com/a-/ALV-UjVwvYDSl-a67KJNaeHve2eh3svbVMBd8zePJJTZwZMsBG5LKco,Kenapa setiap saya komen selalu dihapus,1,4,34.1.5,2024-04-11 02:03:47,,,34.1.5
86108672-92a2-45ce-8d9b-2ac848e68089,Jani Canra,https://play-lh.googleusercontent.com/a/ACg8ocLtCgjrZY1siKa_BDaHfiA2wZfAaxI1K_g31zrSdXyTDghj=mo,Byisa nambah wawasan and hot hot....yess,3,3,33.6.3,2024-03-01 09:45:59,,,33.6.3
c8e01c05-a499-4aab-96fe-003037e3e85e,muh fahkri al khair,https://play-lh.googleusercontent.com/a-/ALV-UjUwYnLE1S39OXcG_tLcBk4ULe6cwQ34QbSTaMRBB1PeMOUJMiw-,aku sangat suka aplikasi ini,5,4,33.7.4,2024-04-08 07:23:34,,,33.7.4
2ab90259-2dba-409a-94d6-389655de85f7,Ati.maryati Arya,https://play-lh.googleusercontent.com/a/ACg8ocJllKLLA8QCAjEE4r0HtfkX_3xi1654ijmdJCFx38XB0XoBog=mo,Semoga lebih baik dan selalu bgus,5,5,34.1.5,2024-04-05 01:53:17,,,34.1.5
b93e2579-3936-4c4f-b9cb-825e916771f0,octavio costa nunes,https://play-lh.googleusercontent.com/a/ACg8ocLlAWtGz2D7K2s4CHBGuYoQZsFjMeS0zFJR_LLPG7OYAmoJnQ=mo,Apk sangat indah,5,2,34.0.3,2024-03-29 10:29:40,,,34.0.3
adf54a2d-f452-4c7d-a4e9-53068e2133e1,Fitriani Ekawati,https://play-lh.googleusercontent.com/a-/ALV-UjX8cyVzYag0s2Jj9D1ZMPJSM2oOMilF1idyFKaxit_JyG2cAxf8,Kok g ada fitur posting ulang sama tiktok shop?,3,3,33.4.3,2024-02-27 16:40:01,,,33.4.3
7faea66e-a67f-48f6-ac5f-fc11185d3c78,KING FOX,https://play-lh.googleusercontent.com/a-/ALV-UjUh_w7HOIf5e_Jc2FjabnnKXq9e6sKX8eV2i6k1eyQTG7sr6rI,Tolonglah tambahin fitur Upload hd di tiktok.jgn cuma di amerika atau di iphone itupun di phone nlbelum tentu .please saya konten kreator sangat membutuhkan.karna saya capek editing tapi tidak hd,2,614,25.2.4,2022-08-07 08:49:25,,,25.2.4
3f73b9a6-68c4-4a74-b50c-88ce441fbda6,kardi Madinah,https://play-lh.googleusercontent.com/a-/ALV-UjWRYUgHsrdZbkEexneIZv8lhLWZqSbtr1fmZWHc5P1Q-0dWPXc,Tik tok tidak netral,1,2,34.1.5,2024-04-04 00:42:13,,,34.1.5
4ab0e13f-bf01-48a5-9d84-6d4be5c6703d,Alc Dyna,https://play-lh.googleusercontent.com/a/ACg8ocLhjS0OM18cb-S63KyfhEBze5bWNCF7JauOVkPx3qEGzfd82w=mo,"Cba pihak mu profesional dikit,jgn main bend akun org seenk mu aj mentang² akun tersebut tdk menguntungkan pihakmu",1,4,33.9.4,2024-03-21 20:51:20,,,33.9.4
4afd96ce-e70f-4a47-a229-0d68784dcaeb,As As,https://play-lh.googleusercontent.com/a/ACg8ocKRgFNv1LKh4FqVyVnckjnWhdfH3ZWuTQjpSxB-19ZZ7hKAmg=mo,Efek tidak bisa d gunakan,1,2,34.1.3,2024-03-31 02:42:13,,,34.1.3
ca909e9b-ea5a-443c-9ffa-66567ca626d7,Nizam Alfaruq,https://play-lh.googleusercontent.com/a/ACg8ocK69Bm9Ei_es-lGfd7Hi31_ZawccNkaOLVZ_S3nZfKom7bfMg=mo,Sekarang udah bisa komen foto,5,5,33.8.5,2024-03-16 16:25:33,,,33.8.5
e45e39f2-fca5-41d5-a4da-561aa5b0b279,Ekho Chaky,https://play-lh.googleusercontent.com/a-/ALV-UjV6tWMTtKDt4CPq_kpiBm1M5UjIxyV7PudyEAWNnfC8HziqA1u5,"Susah banget mau top up coin nya, lainkali tolong donk d permudahh untuk proses top up nya biar kami pun betah pake aplikasinya...",1,2,,2024-04-17 03:47:20,,,
a8bebab2-c37f-4f85-baa0-296103a53ccb,Paya Ray,https://play-lh.googleusercontent.com/a-/ALV-UjUqdgLC1cXhJIw80T6Q_M18iXivs3Mb0OUySYbDFh7-_wCL7o8,Bagus sih Tapi kalo mau coba filter terbaru harus update dan itu membutuhkan waktu,5,0,30.7.4,2024-05-09 09:03:02,,,30.7.4
8ed0bc28-2159-4b49-b506-0bade6c140ee,Ma Ti,https://play-lh.googleusercontent.com/a/ACg8ocK7ksGs2MU_PBI_v2P3Qqmp1ZfUTaKQ1vRsFgDpvo8z9hiQ8w=mo,"Tidak bisa di download,padahal pakai wifi, ruang penyimpanan masih byk ruang",1,0,,2024-05-12 18:38:20,,,
7a61c2fb-951d-40d0-bf90-f6e30a3dd803,Pengguna Google,https://play-lh.googleusercontent.com/EGemoI2NTXmTsBVtJqk8jxF9rh8ApRWfsIMQSt2uE4OcpQqbFu7f7NbTK05lx80nuSijCz7sc3a277R67g,"Asalammualaikum nama saya syaila fairuzaSaya suka banget dengan aplikasi ini ,aplikasi ini menghibur saya saat lagi sendirian dan banyak video yang bisa di palajari semoga aplikasi ini menjadi aplikasi yang paling kita suka sedunia ya teman-teman😊😊😊😊😊😊😊😊😊",5,13,,2020-02-25 13:57:47,,,
001f8284-8893-4fa1-984e-5bb6ebd853c1,Isabela 031,https://play-lh.googleusercontent.com/a/ACg8ocLTE9jYJZwOId9eEF7KV8c3GiklWbDlOIyUDI3Hci4ILMIgKQ=mo,"Bermanfaat jika di gunakan untuk hal yg baik apalagi untuk menyebarkan dakwah, tausiah dan hal hal yang memberikan energi positif kepada seluruh pengguna tik tok. Terutama kepada ummat muslim sedunia. Thank's",5,1079,31.1.4,2023-09-11 03:15:27,,,31.1.4
c32d18b6-600e-44eb-970e-96b27990e17d,Eg Ry,https://play-lh.googleusercontent.com/a/ACg8ocJpBRd1le55zHuNk-r2nyhgMhTYjkNufAepLJubRTPbW1hBQA=mo,Sayang sekali ko lagu2 nya gk pada muncul,3,16,32.6.5,2023-12-24 01:01:16,,,32.6.5
1b4384b5-72de-4dda-9998-8b7bde4e9cc6,Deirzkma Deirzkma,https://play-lh.googleusercontent.com/a/ACg8ocL0h6YnMXvSNFthxIZaaAKE3FvqIxevAM0JCFWtni5Osq4aXw=mo,Saya sangat suka aplikasi ini tapi kenapa masih ada video yg seharus nya tidak boleh di tayang kan 😅😅😫😫soal nya kan di aplikasi ini masih ada anak kecil yg masih nonton aplikasi ini nanti bisa bisa jadi conto yg buruk,1,11,,2020-09-06 10:11:04,,,
bea80a3e-8dd7-4372-9e45-d9758516f61c,Safitri Utina,https://play-lh.googleusercontent.com/a/ACg8ocJ7jwEdFeKNeOZlP_S73kNTC7UJ36DqfvXuSpfdbOF8gwsLaA=mo,"Aplikasi ini sangat bagus, jika digunakan dengan baik tiktok akan jadi aplikasi terbaik untuk saling berkomunikasi dan berkarya sesuai minat dan bakat masing2 pengguna tiktok.",5,821,23.6.4,2022-03-20 13:08:28,,,23.6.4
40fa1504-e6bb-4f8b-b0d4-a968eed8ff07,agus saha,https://play-lh.googleusercontent.com/a-/ALV-UjXaaVp68UUkqOt2SHB54HetaEkg102Fw6OHoATCnsJtVRFQITnH,Belakang ini aplikasinya suka ngelek.Jadi Saya kasih bintang 2 dulu samapai aplikasinya berjalan normal seperti di belakanagn ini,2,18,32.4.3,2023-12-03 22:10:48,,,32.4.3
28527775-3769-4bf3-8e95-6f56c37e8b2c,Choi Chinta,https://play-lh.googleusercontent.com/a/ACg8ocJd7yXUd-IvLrmzfwO_WS0jjD16uCcxaMBykX9QwuX2iESNog=mo,Gatau kenapa kalo nonton live atau mau live suka lelet padahal kuota masih bnyk,1,12,33.2.5,2024-02-01 20:19:11,,,33.2.5
b340f8bf-67fa-4539-b9c9-a9db4757d377,Kokom Komariah,https://play-lh.googleusercontent.com/a-/ALV-UjW9hwO0LPQFWBjIE8pdAH0bWgm-1FTkqGvVUSZlAsxkUL417TTd,Menghibur banget untuk sya .selama bekerja diluar,5,19,32.4.3,2023-12-12 11:50:52,,,32.4.3
a4f9c275-beb7-4cec-bc1b-79dfb626f8f8,Gaspar do Rego,https://play-lh.googleusercontent.com/a-/ALV-UjXpkTp7wmb-4viR_zNqtKFggOkZtQ2dnXu9WWtYh219r_L3ZuHY,Sangat lama untuk bisa menginstal nya jadi saya tidak suka dengan aplikasi ini. 🤬🤝,2,9,32.7.6,2024-01-22 15:58:20,,,32.7.6
5ef8c049-8f0e-4f66-934a-7c8fe8c8cc9f,Sudjud Karyo bekti,https://play-lh.googleusercontent.com/a-/ALV-UjUkw3Pz-BFGu_w2mUrVcRjHgOIfsnV2hfsQUH0PRujMe6slkiU,Tiktok semakin lama semakin susah untuk di oprasikan.,1,18,32.3.5,2023-11-29 07:29:26,,,32.3.5
956d3f80-1d6d-47c3-a3ba-8247db4ae80b,Alhamdulillah Hirobbilalamin,https://play-lh.googleusercontent.com/a/ACg8ocL9cjVPGu-Sw-LI3jFC59vS7CKfHIOvyI3JLHJQQUijU4cZdA=mo,Ngleg fulllllll 24 jam gimna nih tiktok makin kedepan makin kurang bagus,1,11,33.2.5,2024-02-05 23:40:36,,,33.2.5
109ef04d-ac65-4053-a693-c71c0c6db16e,Alfiah Ssandi,https://play-lh.googleusercontent.com/a-/ALV-UjV78fB9DqI3liTOK20Hi5B9Zg73tj1q1u03iFV3KiUCgtbiF5o,Untuk live streaming sinyal nya putus putus,2,16,33.2.5,2024-02-02 18:56:54,,,33.2.5
2b90f8d5-4ca2-43c6-a36d-04ca89e943eb,Dini Mekkah,https://play-lh.googleusercontent.com/a/ACg8ocLU9POLyGvirALAI9OCEBGuPIpvMSwVPfd1q6D5FueUc4iP2A=mo,Ngk bisa bukak live selalu ngeleg padahal kuota banyak,1,12,33.1.4,2024-01-29 17:24:42,,,33.1.4
69bdcea8-a715-45a5-8c08-61697ec09ec3,Nazario Siqueira,https://play-lh.googleusercontent.com/a/ACg8ocI1H5Cgj04I-wY_UL3pRVqUqD4w39Lt4eEwpXUP-X1NOUekYw=mo,𝐀𝐩𝐥𝐢𝐤𝐚𝐬𝐢𝐧𝐲𝐚 𝐣𝐞𝐥𝐞𝐤 𝐛𝐚𝐧𝐠𝐚𝐭..........!!!!!!!!!!!!!!!!!!!!!!!!!!!!!!!!!!!!!!….....…........................𝐓𝐚𝐩𝐢 𝐛𝐨𝐡𝐨𝐧𝐠..! 𝐀𝐩𝐥𝐢𝐤𝐚𝐬𝐢𝐧𝐲𝐚 𝐬𝐚𝐧𝐠𝐚𝐭 𝐛𝐚𝐠𝐮𝐬 𝐝𝐚𝐧 𝐬𝐚𝐧𝐠𝐚𝐭 𝐦𝐞𝐧𝐠𝐡𝐢𝐛𝐮𝐫👌,5,9,19.8.3,2022-03-25 07:12:10,,,19.8.3
7b3b40b9-e297-4934-b4d5-b19884e76f74,Santomi Sakiroh,https://play-lh.googleusercontent.com/a-/ALV-UjXYSigGCq-XoU0IHeTSnh-6LPClbBOt4eeTzjJ8pH2bnwXBBw68,Kenapa hari-hari ini di live engga bisa kirim korun atau gody bag ya awalnya aman dn normal sekarang ko susah tolong dong berbaiki lgi biar normal seperti biasa,5,17,32.6.4,2023-12-19 13:33:06,,,32.6.4
2b0994e6-3ac1-4d11-a5cf-1f3ad79d25e8,Vio Elma,https://play-lh.googleusercontent.com/a/ACg8ocLGMPlEr6dtzIX77AjG2ku7soN-glxL35vCF9iQNFwWj2xa8w=mo,Sangat menghibur tapi sayang aku pemula belom bisa live kaya orang2 di tiktok,5,13,32.4.3,2023-12-10 15:47:37,,,32.4.3
5a7a5095-43a3-41c7-ab15-aa33ed05f6d9,Andri YN,https://play-lh.googleusercontent.com/a/ACg8ocJmetLPh0wpy-A9v_2KBoRbND5GNe3uDsphCVNxTEh3mE8-rg=mo,Kurang koneksi smoga ditingkatkan lagi,3,15,32.3.4,2023-11-27 23:14:50,,,32.3.4
57428f9f-a8ea-4517-903d-4079ff6a2d95,Izam Rycko,https://play-lh.googleusercontent.com/a/ACg8ocJAWMGL2T5VWdwdfgyViRfFPGPRAsaiB24s770yAc-g4HJs-A=mo,"Cocok buat foto komen tapi ada yang ngemis like, follower, share, jangan bawa nama agama",5,16,32.5.3,2023-12-16 11:53:33,,,32.5.3
3d7281ec-f6bd-40f8-ab30-7d6e96ea0226,Sofyan Chomier,https://play-lh.googleusercontent.com/a-/ALV-UjXSbYPdYf9SYP9pZKO7TExPjOEKmmiJSPnACvDM_Abi4Bq7DFIm,Banyak konten yang menghancurkan moral generasi muda yang tidak pantas ditayangkan..,1,15,32.7.5,2023-12-26 12:33:26,,,32.7.5
724475a2-34ee-4867-ac59-986628820dc1,Fatku Sari,https://play-lh.googleusercontent.com/a/ACg8ocKnPy3My-e0WsWme4QLh_TjLwWubDm1-VUogF8w7AJWtZpUeQ=mo,"Admin tolong gimana ya supaya bisa download aplikasinya tik tok dan smua y tdk bisa alasan ya jaringan,menunggu jrngan wifi dll Makasih",5,10,,2020-09-13 11:48:50,,,
f0f21081-82fb-45e9-9f02-806aa3e64e3f,Pengguna Google,https://play-lh.googleusercontent.com/EGemoI2NTXmTsBVtJqk8jxF9rh8ApRWfsIMQSt2uE4OcpQqbFu7f7NbTK05lx80nuSijCz7sc3a277R67g,seru siihh.. jdi bisa kreatif bikin koreo2 baru dan bisa kasih challenge ke temen2.. makasih sdh d berikan tempat untuk explore.. 😁👍🏽 add yaa hyangrestus,5,437,15.7.5,2020-04-23 00:06:02,,,15.7.5
94413da2-d63f-4027-ace5-241f1a0e718a,Muy Haya,https://play-lh.googleusercontent.com/a/ACg8ocJJU2auLaiL7zLn1CUX5Iu4c9BEJIMVi4S3_0YM-tLlnwmtSw=mo,Aga kecewa aja si filter facelift hilang soalnya itu filter tidak banyak merubah bentuk asli tapi natural bgt hasil akhirnya..kalo yg laen kan pada menor² terus hidung mancung kebangetan ga cocok🙂,4,200,30.9.3,2023-08-18 15:35:22,,,30.9.3
63a941ec-74d0-442f-b91f-403e297fcbd6,Iky,https://play-lh.googleusercontent.com/a/ACg8ocK4SQBOzmbQ0HScdJT8PuEFhrsY-W1ysL6cSJHQI0uZAUKCGw=mo,Untuk pihak tiktok kenapa di saya tidak bisa menarik saldo atau koin pdhl sudah mencukupi untuk melakukan penarikan setiap ingin melakukan penarikan pasti ada tulisan jumlah pernarikan telah melebihi frekuensi jadi tolonglah untuk pihak tiktok segera di perbaiki saya sudah susah susah untuk mengumpulkan Koin atau saldo percuma jdinya klw tidak bisa di tarik,3,8,,2021-06-12 16:08:23,,,
4a606598-239c-4f32-9eaa-5ab9bf6808ae,Lyla Fraga,https://play-lh.googleusercontent.com/a/ACg8ocKLmGMwdymQPJaDJOuBMonENkHJozX9iNK6bTIZsfCTVwmVvw=mo,Apk ini tidak bisa digunakan dan tolong isi ulang koin nya dan keranjan kuning nya juga gak ada ditambah lagi peti juga gak ada pokoknya diperbaiki dulu deh baru ditambah bintangnya,2,23,27.8.4,2023-05-25 17:53:44,,,27.8.4
6690fdea-731c-4f50-8f26-036a1eee29c0,Pengguna Google,https://play-lh.googleusercontent.com/EGemoI2NTXmTsBVtJqk8jxF9rh8ApRWfsIMQSt2uE4OcpQqbFu7f7NbTK05lx80nuSijCz7sc3a277R67g,Tik tok ini bagus makasih ya. Pokoknya kalo yang gak dowload bakalan nyesel bangettt . Yang belum dowload nanti dowload aplikasi tik tok yah.,5,12,,2020-03-18 19:19:58,,,
3ded9328-1715-4c62-81b8-ee6f20db1b2f,Link Trosobo,https://play-lh.googleusercontent.com/a-/ALV-UjU1-4yPmbltJMF_naKISKlhTarz4dK9bBeL2DsLnVs_Fg6vA_I5,"Seperti apk yg lain, klo user sdh rame pasti server sering down & aplikasi force close. Sejauh ini saya msh suka apk keluaran dr facebook dan saudara2nya.",1,18,,2020-06-23 10:43:06,,,
3d56ad3a-6aa0-4154-b2db-a95afb96ffe4,Ismail,https://play-lh.googleusercontent.com/a/ACg8ocL2ZcC-ok1ZYM6ia7gIhc9aAncT_TMA6ShhN4X1xIRxuOD2sPo=mo,"agak sedikit terbatas untuk pengguna android, salah satu fitur yang hilang adalah tidak adanya mic pada fitur duet-nya",3,327,17.4.2,2020-08-23 01:02:18,,,17.4.2
1b41eb0e-7459-4831-8f17-2485090532de,Pengguna Google,https://play-lh.googleusercontent.com/EGemoI2NTXmTsBVtJqk8jxF9rh8ApRWfsIMQSt2uE4OcpQqbFu7f7NbTK05lx80nuSijCz7sc3a277R67g,Pertama kalinya aku bingung kenapa ada dua tik tok yang satu 55mb yang satunya 52mb nah aku donwload dua-duanya dan aku bandingin padahal tik tok yang versi 52mb ini seperti mempunyai garansi itu loh.seperti kalau kita beli hp lewat online pasti punya garansi nah tik tok ini mempunyai garansi musically dan itu sangant bagus GOOD JOOB,5,13,,2019-11-24 20:36:23,,,
da6a27ce-1948-4155-a681-f0b1ce83df76,Cinta amk,https://play-lh.googleusercontent.com/a-/ALV-UjVQtYFezZOynRCmsi_p2RdH79uxJ-j6yTxK3jvjRX4SrXzs6Rltow,"Aku bingung knp klu komen di kubu 01 dan 03 sllu di hapus, sdng kan klu kubu 01 dan 03 wlupun komentar nya gk beradab gk kena pelanggaran, smg adminnya sllu profisional",1,2,34.2.3,2024-04-15 12:32:07,,,34.2.3
4642b7c0-8e0f-41a0-9eff-aa8780427e29,Ochy JL,https://play-lh.googleusercontent.com/a-/ALV-UjXsnjzd3_T5BcD35Vs6ITkpsLNg022B6HE0_eFvN_DJtK8-osA,"Ga seru soalnya gabisa namatin, kayak di game-game sebelah, ga ada history dan gabisa jalan-jalan kayak gta, cuma video yg ga jelas, di perbaiki lagi yah",1,66,30.1.3,2023-08-15 10:58:06,,,30.1.3
c2991cb9-0b65-496e-a6f5-494fc43e1011,Frances Cade SOUSA,https://play-lh.googleusercontent.com/a-/ALV-UjW_o4Q_4ejCDeMFBVpgfR4WczT7kaE1EyIpHyjDlnXFjtNcrg9KiQ,"Aplikasinya bagus banget,karna kita bole mengedit video trus ada video yang bagus bagnet",5,3,,2024-03-28 13:10:25,,,
b7e8ac9d-e04e-4154-98c7-a238a355fe1b,Lukman Panca,https://play-lh.googleusercontent.com/a/ACg8ocLe4fSqmwgK_KKdjoxQ--pZM5HgSltelqg1ZR1JuJKg6LudFw=mo,Saya selama ini bayak yg ter ganggu kenyamanan dan masalah dipakai mati jadi aku gaya an dengan pemalsuan nya,5,3,,2024-04-07 16:24:48,,,
5ca46516-4aad-447c-96cb-7f1075a87359,Samuel Francisco Guterres,https://play-lh.googleusercontent.com/a/ACg8ocJ4tXNNupOce8hZCeLGqfA_6QinZdBm-JAlnrpvDrw3x9FVEQ=mo,Akun saya tidak bisa live dan sekarang mau bikin Vidio juga tidak bagus masa bikin Vidio baru mulai musiknya sudah habis padahal baru 5 detik musiknya sudah habis.tolong di pertimbangkan lagi ya terima kasih,1,175,31.1.4,2023-09-03 21:54:12,,,31.1.4
52339f9a-8ae1-4ee6-a404-ef6be1959d4c,Grace Sinaga,https://play-lh.googleusercontent.com/a-/ALV-UjU-QHeDLlMg3Xb2gH7XX-HFHRRUxz5i6AW5ZNZJfPohKomgHHKt,"Kenapa yaa akuu mau daftar akun terus waktu masukkin tanggal, bulan, tahun lahir muncul tulisan ""Maaf sepertinya Anda tidak memenuhi syarat untuk TikTok... Tetapi terimakasih sudah tertarik!"". Cara nya gimana yaa?",5,10,,2021-01-16 10:37:34,,,
4241bd63-bd84-45e1-a6a7-ae4343c1f6bf,Conceicao Gates,https://play-lh.googleusercontent.com/a-/ALV-UjWe41_-IwaJzTrh5yEduaE12ANO_ZYCBD1lNgwXTnjxaJW99Hw,"Maaf gw kasi 4bintang aja karena lemot trus, padahal jaringannya bagus bangat, mohon selesaikan kendalannya",4,0,,2024-05-02 02:46:57,,,
683c7e25-3b84-4b29-b1fe-2704ccf5fe65,Susilo Utomo,https://play-lh.googleusercontent.com/a/ACg8ocKrql7CMOnO2t1xxZ2jhMWMuPq7K67HCHqB1iYCJYKZeqyAUA=mo,App yang sangat bagus dan sangat membantu,5,15,32.7.5,2023-12-25 11:15:46,,,32.7.5
e286a79a-aaf1-412a-82b0-91cb3fd74ed2,Emis Putri,https://play-lh.googleusercontent.com/a-/ALV-UjWXDuf15Q0ojeKswvyyL3matCLBTu1XzLSIXBOh6qFp5XkI1uge,Kenapa sya tidak bisa download check out tiktok shop nya selalu muncul percobaan terlalu banyak kenapa yah? Tolong dong diperbaiki yahh Nanti kalau udah bisa aku kasik bintang 5,1,15,,2022-04-10 21:49:53,,,
83db029d-8507-4dee-83ba-cf8b73147d77,Calysta Sitepu,https://play-lh.googleusercontent.com/a-/ALV-UjXiQmr-MoKYxO89-Hh_UQX8J5Bda88DY75rMTAGUI6uFQuFMsCN,Kenapa ni aplikasi suka terhapus sendiri ya lalu kalo mau di download katanya maaf tidak dapat menginstal itu knp y,3,4,,2024-02-26 23:26:15,,,
a301c00e-e2c3-48ee-8658-72aab0b65cf0,Gadith Sembarang,https://play-lh.googleusercontent.com/a/ACg8ocL7urg8_10WGnH1_u2C66AnEEjIysK_TSIF8nF8n5LJXwOIog=mo,Saya suka banget sama tiktok tapi tolong lah ditambahin filter yg bisa bikin HD sama di tambah keranjang kuning nya soalnya saya suka berbelanja,4,13,,2022-08-17 09:26:25,,,
a4ba78c9-e448-462a-9fee-68a6a93a6dbd,syafiuddin Abbas,https://play-lh.googleusercontent.com/a-/ALV-UjUQePI5KZQ5FmS9KLuvBh-sjBFXsr1ghiSM859JRx27LpHx5rmG,Seing gk bisa di buka,5,0,34.5.5,2024-05-05 14:03:45,,,34.5.5
c48179b4-4500-4f30-afc0-244819e8461f,Pengguna Google,https://play-lh.googleusercontent.com/EGemoI2NTXmTsBVtJqk8jxF9rh8ApRWfsIMQSt2uE4OcpQqbFu7f7NbTK05lx80nuSijCz7sc3a277R67g,"Kembalikan versi yang lama, saya gk suka versi yang baru-_- kenapa harus jadi tiktok...tolong balikin musical.ly yang dulu",1,55,8.5.0,2018-09-22 16:31:26,,,8.5.0
187295b0-c57a-4456-866a-03858e223e97,Orang Sunda,https://play-lh.googleusercontent.com/a/ACg8ocLmlpjqqH_GIc3Fz6V9TJSHHYWdOr0DpnPXj1oyvYUfNla8xw=mo,Tiktok nya jelek tolong perbaiki aku baru menginstal tapi pas ada tanda buka aku pencet ga bisa tolong di perbaiki ya!,2,3,,2024-01-14 12:24:28,,,
8b727d0d-adf4-4fb8-be64-5582e2483ad8,gsky gelin,https://play-lh.googleusercontent.com/a-/ALV-UjVuoQEe7dDSYJo6nahg-bRBbOoICoWzX4GnNwTyTYXG_C8aQaFb,"Aplikasi sampah!suruh masukkin tanggal lahir salah.kan betul,malah salah,aplikasi gak guna!!!!! .mending dihapus aja dari playstore Semoga app ini dihapus dari playstore. Amin!!!",2,123,22.4.5,2021-12-19 11:11:10,,,22.4.5
34498aeb-13bb-4f78-8536-0b2076175e1b,RP Gaming,https://play-lh.googleusercontent.com/a-/ALV-UjXV8S9MEzrEbKbw80frckHkVROCCcNnFse8utXk2FxvkzSL2FHg,"Kenapa, kalo kita membuka komentar, itu pin komentar nya kok gaada malahan pin nya random, bukan dikasih paling atas, tolong perbaiki lagi supaya saya bisa nyaman mainin tiktok nya",4,10,,2022-07-21 16:42:39,,,
265d5121-3acf-4c64-ba37-bd7970dfd298,Hermenegildo Da costa Gusmao,https://play-lh.googleusercontent.com/a/ACg8ocLn8TTSWNduXE7jhvO2I5wic6sTIF0ypelRAtB-xKNU0bQY1Q=mo,Aplikasinya Bagus Menhibur kita tapi Mau Updatenya yang susah sekali Coba Harap kan Ulang ber ulang gituh gini gini nia gue gak mau update tapi efek di dalamnya yang bagus semua Gak dia Coba Pasti menyesal tapi update yang lama Dah selalu Harap coba lagi 😒,3,8,22.4.5,2023-07-02 12:40:25,,,22.4.5
5ff5199b-dae9-48b2-8ced-7cbee294677c,Gabriella Rempas_,https://play-lh.googleusercontent.com/a-/ALV-UjVUHiIeiToJ2Af4heNqECv8niBPWjZP1goMBttmcTG4yZPDBUiF,Aplikasi ini sangat berguna sekali!tapi baru download dan buka 5 menit chace sudah 500mb ntah kenapa:(( tolong perbaiki,5,15,,2022-02-21 08:48:19,,,
4c4dafbf-bb1a-4495-a5aa-992b3f5cb850,Een Solihat,https://play-lh.googleusercontent.com/a-/ALV-UjXPca2_9Gvo3iAaLIcwZ9zyzErG3fbZr4-YSjajM7xSoCBNQuI,"Mohon di tingkat kan lagi soalnya epek buat jadi komal sekarang ad yg bisa di gunakan dan ad yg tidak bisa ,,gak seperti dulu",5,9,,2023-04-22 09:28:52,,,
b6ef9022-8f56-4c95-9b8f-050d23c5ef4f,Alfredo Beto,https://play-lh.googleusercontent.com/a-/ALV-UjWOnlCuf6BFRxENHJGh6vPUfIpCHzpXIuNQAEWDCSUK2QnKo85j,Mudah-mudahan Tiktok bisa membantu saya🙏,5,4,33.8.5,2024-03-15 10:10:18,,,33.8.5
