reviewId,userName,userImage,content,score,thumbsUpCount,reviewCreatedVersion,at,replyContent,repliedAt,appVersion
ee698e40-fbec-4c64-afbf-c9a53e7d0aa8,Abby Hany,https://play-lh.googleusercontent.com/a/ACg8ocIt1jueX7a7Q4nb4xMUu1Wcnq6rguMqtdP9CnbOI4r-j5xx_Q=mo,Sangat menghibur dan memuaskan,4,4,32.2.3,2023-11-28 09:31:24,,,32.2.3
b7350d2d-dbf7-4251-970e-4e238fa57224,Fitriyah Apriliani,https://play-lh.googleusercontent.com/a/ACg8ocKCaWYOZtZnRFdwhVaNT5wo-zetW540OwDS_SyFI95o252hDw=mo,"Aplikasi tiktok sangat bagus , cuma kadang ada sedikit masalah kallo ada yang komentar trus di balas suka ga muncul balesannya",5,346,18.7.5,2021-03-12 13:05:47,,,18.7.5
b2aa295e-0c3f-4388-9511-72f6a00cd905,Linanda Febriana,https://play-lh.googleusercontent.com/a/ACg8ocJODmNtXQWZrKjZs1vPwGeL05e3Z4WNgH02wxdbMp1khCTMqQ=mo,apa cuma tiktok ku yg gK bisa di upgrade sama belum ada krenjang kuningnya. tolong solusinya dong. software udah pembaruan kok,1,162,27.7.3,2023-02-13 19:38:30,,,27.7.3
013d2fba-e521-43c2-af1f-0bc13b7703c7,Ida Nurhayati,https://play-lh.googleusercontent.com/a/ACg8ocLprr8IljmSNVBGh7dS7cWmI7cUXCWBpXsVflhpJb_Ie8kvxIM=mo,"Banyak membantu shop online nya, walau sy di Saudi 🇸🇦 bisa belanja Keperluan yg sy inginkan dan untuk harga ny murah², terimakasih tiktok",5,71,31.3.4,2023-09-21 07:06:23,,,31.3.4
8e1a2c4d-a526-494d-bed9-9dd5e08c930f,Muhammad Maulana Ishaq,https://play-lh.googleusercontent.com/a-/ALV-UjUDpoUECZpgwE9ShVVK9KS-tLxgE39F0JZ2orFxjn3jF3YxbykPmg,"Saya suka tiktok ,saya bisa belajar banyak tentang kehidupan,shalat dan bacaannya ,ceramah yang sangat bagus.",5,4,6.9.0,2021-09-18 13:04:11,,,6.9.0
7b9d3c9a-0f81-4552-98e9-6207fada06eb,Bhakti Andaru,https://play-lh.googleusercontent.com/a-/ALV-UjXsfxlAl6O-a1NrU05FOVorAukNxv71YX047cvp0Xe4l_A_QjU,"Aplikasinya bagus, agak kurang dikit sih menurut saya, Baca! APLIKASINYA, bukan usernya awokawok",4,7,,2020-11-25 07:42:16,,,
e42e3215-afb3-4d36-9ef2-c4b235f2665e,INO LUCIO,https://play-lh.googleusercontent.com/a/ACg8ocL5Daua_Ul-qxJ4jQW6ACdECjmIaVnVAOnPBWG5_EY9vq9iFw=mo,Tik tok anj... Nickname nya ko ga ada larangannya buat orang2 anjin yang menghina agama ko ga di blokir... tolong blokir orang2 yang nickname nya menghina agama tolon di blokir,1,0,34.4.4,2024-05-08 00:14:28,,,34.4.4
c9745739-a2db-4ece-b997-6fae9174b61c,Laode Abdulfarid,https://play-lh.googleusercontent.com/a-/ALV-UjV2QLz-iImZtuiwW1fqWXPSf1ztGUT4YFZXZcokOa-U7bg35YAd,baik digunakan,5,0,34.5.5,2024-05-01 22:44:31,,,34.5.5
246e6c58-e736-4871-917a-ebcd3bd01c5d,Pengguna Google,https://play-lh.googleusercontent.com/EGemoI2NTXmTsBVtJqk8jxF9rh8ApRWfsIMQSt2uE4OcpQqbFu7f7NbTK05lx80nuSijCz7sc3a277R67g,"Kenapa saya memberi bintang 5, karena tiktok ini bisa menghilangkan stress disaat kita frustasi dengan kerjaan maupin masalah** lain.",5,5,,2020-03-15 15:10:37,,,
cf8732f9-ef27-4891-a0b6-64ca96437889,Sadiyah Rezkyansa,https://play-lh.googleusercontent.com/a-/ALV-UjX4KUDT7UdHosu6g-e-sBE7zXO1TaBlJCDT2D83WNM9IHy8KtiZ,Mantul buat hiburan mantep thebest pokoknya,5,10,32.6.5,2023-12-25 13:09:48,,,32.6.5
ab828f72-d641-4757-b38d-77b213676759,Pengguna Google,https://play-lh.googleusercontent.com/EGemoI2NTXmTsBVtJqk8jxF9rh8ApRWfsIMQSt2uE4OcpQqbFu7f7NbTK05lx80nuSijCz7sc3a277R67g,"Aplikasi gk bisa di download padahal internet kuat,penyimpanan banyak! Download apk lain bisa tapi untuk apk tiktok gk bisa",1,10,,2020-01-18 16:13:28,,,
4a228183-6670-43e5-84b4-4a2ed87d6960,KOCAK Gaming,https://play-lh.googleusercontent.com/a-/ALV-UjWOEkf2fJDJfcpI2iUvva_30HXrDQyxFcu9DL9P3m2JeaMT_69_vw,Ini bagus banget sih buat berkarya dan banyak bet fitur nya dan yang paling gw suka itu di beranda ada video ooaim diketu ngakak bet sih keren dah,5,5,,2022-04-26 10:47:25,,,
22d31b99-e69b-4796-9752-e59d47b60c48,Pengguna Google,https://play-lh.googleusercontent.com/EGemoI2NTXmTsBVtJqk8jxF9rh8ApRWfsIMQSt2uE4OcpQqbFu7f7NbTK05lx80nuSijCz7sc3a277R67g,kenapa sekarang app tiktok tidak bisa menambahkan lagu dari file musik hp sendiri,2,107,12.3.6,2019-08-01 00:56:25,,,12.3.6
80a7cad3-1e0f-408d-be24-38be196093de,Sudarmi Jiyamto,https://play-lh.googleusercontent.com/a/ACg8ocIS48dQo4S8nzfObYjab9BY7XOkCHx5CF9RNOA6bP5b6TZ4HQ=mo,"Bagus banyak peminat, mudah di akses, dulu aku mimpi sekarang jadi kenyataan bisa menggunakan tik tok salam bos tik tok,, terimakasih semoga aku banyak yg kasih like dan following,,",5,373,22.6.5,2022-01-05 06:52:03,,,22.6.5
25602af9-8fe7-422c-8f1e-22b684c3c3c2,Evelina Silva,https://play-lh.googleusercontent.com/a/ACg8ocKY4zsuLIkPaSfUm0_BCdluq1qPWqbUyAmqyepqqzhVe_jU2w=mo,Sangat bagus dan Sangat menghibur.tapi aplikasi tik tok yang saya Pakai ini gak bisa foto lagi .tolong dong bisa bikin foto dong.,5,56,30.9.4,2023-09-01 06:20:40,,,30.9.4
76482de9-2433-4ac6-b404-a178db13780d,AnqueciaClotata Carvalho,https://play-lh.googleusercontent.com/a/ACg8ocIY7d3an2DNVUkJLpBrjvh6HqXrn3rsjQNAkZ13MrkRUMflVA=mo,"Sedikit kecewa sama tiktok kenapa setiap nonton salalu muncul jaringan tidak tersedia padahal jaringan bagus"" aja kalo nontonnya lama Mala minta kode tiktok hmmmm tolon perbaik 🙏💔",2,84,30.5.3,2023-08-10 18:36:33,,,30.5.3
7c2ab97b-641f-4084-9f9a-ad1fe0522c80,Wendi Tania,https://play-lh.googleusercontent.com/a/ACg8ocKuJY5u_gMqGMPLMEYqTs0t_f424DGItXDNBFGH1a35AYtzPo4=mo,Apa cuma gua yg ngerasa tiktok sekarang pas lagi nonton videonya gebug/mancet gtu? Tolong TikTok kita yg lagi nonton merasa terganggu.,1,5,,2023-03-21 00:33:47,,,
63c59f4c-16af-4881-8601-db1579c8fc28,Pengguna Google,https://play-lh.googleusercontent.com/EGemoI2NTXmTsBVtJqk8jxF9rh8ApRWfsIMQSt2uE4OcpQqbFu7f7NbTK05lx80nuSijCz7sc3a277R67g,Bagus sih tapi donload nya kok lama dan diulang terus mohon pihak tik tok diperbaiki🙏🙏instal ny juga lama Jadi gk bisa tik tok kan deh👍,5,5,,2020-04-19 08:45:21,,,
d7cfac45-2a81-4a2d-b3ea-db85ed3697c2,Khaerudin Bin marjuki,https://play-lh.googleusercontent.com/a-/ALV-UjVLMnUZPv6PXgQqtyoMRfpJG73AYqBW80Dfrt8AVv9digViIvk,Kenapa tiktok sembarang blokir pesan Makin ga jelas aplikasi ini,1,8,33.3.4,2024-02-10 16:24:13,,,33.3.4
6456e7ce-b4fa-48a3-b044-d888d3f9250e,Aulia Hadju,https://play-lh.googleusercontent.com/a-/ALV-UjXjBV3ZzSA-MeZjXu4OXpHt63xXyKTvMil6V7RSeEVm98MXrgc,tidak bisa di buka,1,0,34.3.3,2024-04-21 23:42:02,,,34.3.3
8fca9ca2-ecaa-4593-98a5-ef0408243019,Nugianti Sagita,https://play-lh.googleusercontent.com/a-/ALV-UjXc98fbuOBgC_2TTPn5oTNb_x692qdAeTTeKVzKkMetPsnMM-SKog,"Kamera tiktok nya jelek banget. Saya sebagai pengguna user android, sangat kecewa dengan kamera yg diberikan oleh tiktok.",1,279,25.6.4,2022-08-20 11:47:31,,,25.6.4
e60ae3d1-ac95-43eb-98ae-2ce5ef16dcca,YT• ALFA,https://play-lh.googleusercontent.com/a-/ALV-UjW8kk_FopdhZd04hq26K0bu3Y_yWV6DdAhl27ETJm9TTdGfGtGY,"Apk sangat bagus dan bisa menjadikan kita semakin pandai dalam membuat fidio, mengedit fidio DLL.",5,4,20.5.3,2022-09-22 16:59:51,,,20.5.3
2ea05b8d-e35e-4995-80be-13002d9ee74f,Pengguna Google,https://play-lh.googleusercontent.com/EGemoI2NTXmTsBVtJqk8jxF9rh8ApRWfsIMQSt2uE4OcpQqbFu7f7NbTK05lx80nuSijCz7sc3a277R67g,"Efek Slowmotion sekarang kurang bagus..masa musik nya ilang begitu,gak bisa pas sama sekali..kecewa gue.",1,204,15.5.5,2020-04-04 23:40:14,,,15.5.5
62e92adf-f3b1-4fe7-a438-c5c11a3535d4,bagi2 no wa artis real,https://play-lh.googleusercontent.com/a/ACg8ocJ3T-8rAZfsg7ZrO0q8tsz1XM_ebhQ3bwasM5ZpFzqg-PAe4Q=mo,"Aku kecewa dengan apk tik tok,duku gk ngelag,kok sekarang suka ngelag jadi untuk masuk tik tok jadi susah,tolong di perbaiki",4,256,18.7.5,2021-03-19 14:27:15,,,18.7.5
f5051cd1-e608-403b-8aa0-4db628f8141b,Ridwan ARFN,https://play-lh.googleusercontent.com/a-/ALV-UjU7TOBHAcGedPI4q5-8zuTjIO2MqgOa0OeU1cM2dD8UNsJvxRI,Sangat buruk.. saya mencoba menonton video lama tetapi tidak mendapatkan point hasil menonton sudah sering seperti ini..,1,67,19.7.4,2021-06-26 23:27:28,,,19.7.4
273c48dc-5aee-4be1-b815-aeb0921f7207,Pengguna Google,https://play-lh.googleusercontent.com/EGemoI2NTXmTsBVtJqk8jxF9rh8ApRWfsIMQSt2uE4OcpQqbFu7f7NbTK05lx80nuSijCz7sc3a277R67g,"mantap njinx.cewenya montok montok cocok buat bacol.saya sarankan tambahkan genrenya seperti japanese,indonesia,blonde,arab,teen,beatiful boobs,dan masih banyak lagi. termiakasih tik tok cewelnya good banget😁",5,448,12.1.5,2019-07-15 15:44:52,,,12.1.5
676d3637-671c-4562-a403-1e776077ea79,Dullan Keken,https://play-lh.googleusercontent.com/a-/ALV-UjXT_9T-1a93GVzHX3D1S3QnzxeFzvDU0TP_oho_jyFUwrA7GLQ,"Apl in sangat menhiburkan, kita semua,, dan begitu, mengenali,, judul judul yg, kita cari cari,,",5,5,,2021-04-22 10:00:12,,,
9f7fde7b-9c6a-4e0d-b3f7-78acfc656005,Anisa Aulia Fujiyanti,https://play-lh.googleusercontent.com/a-/ALV-UjVidno3glJWEQb5ALx-WrzUVaqKpPJwPB1i5CvjzOwY4yAQwAY,"Apk nya bagus cuman lebih difilter lagi untuk yg masuk fyp nya, sekarang jadi susah buat fyp,.",5,4,,2021-02-25 05:05:16,,,
23a9124f-5c5a-44be-a6a5-6967ba302e6f,Mella Lim,https://play-lh.googleusercontent.com/a-/ALV-UjWDis31KrEpa1tT5Q-_GFKMSSDpeZFj017IOuACuGbyt2gudlyi,Tik tok sangat bagus buat hiburan tetapi banyak yang di salah gunakan karena masalah negara saling bakar bendera tolong kasih peringatan jangan bawa bawa negara atau bendera negara dalam membuat video tik tok,5,416,23.3.4,2022-02-28 00:26:19,,,23.3.4
d6ce509d-a2cb-4b3e-ac65-42979cdb6f6a,Ainy Channel,https://play-lh.googleusercontent.com/a-/ALV-UjUhals_LHKKiMENMSYANGHKkC2WOb5x7E0sT-3FE_Y6H9WAKItRtQ,Aplikasi hiburan terbaik saat gabut. Aplikasi Terupdate kalo ada ada info berita dll. Pokoknya aku sukaaa 🥰🥰,5,251,18.8.41,2021-04-07 22:53:54,,,18.8.41
572834a1-aed5-467e-ac58-b6a2130514e2,Amel Delifa,https://play-lh.googleusercontent.com/a-/ALV-UjVf65GfIVhfZOw0mTJvPeZ-Nfw_hUpRlMuHdw9pV-dQ_HdS1W5Z,"kendala di aplikasi tiktok , adalah tidak semua lagu bisa dipakai , ntah di pengaturan apa gmna",5,229,27.1.3,2022-11-29 11:38:02,,,27.1.3
4f577744-0095-45b6-96ee-82da0ea5f65b,elva adi guntoro,https://play-lh.googleusercontent.com/a-/ALV-UjUqt70gNvnbUvI7VnzfKQKaggPmlDOk84urNUj-8jeJCnVpDS4,"Sangat menyenangkan , saya jumpa teman lama / pun baru , di sini juga menyediakan dunia baru yg sangat bagus , saya sangat menyukai aplikasi ini",5,208,27.8.4,2023-01-22 19:46:28,,,27.8.4
fcba8718-6e04-47df-8119-32b75943de1d,Pengguna Google,https://play-lh.googleusercontent.com/EGemoI2NTXmTsBVtJqk8jxF9rh8ApRWfsIMQSt2uE4OcpQqbFu7f7NbTK05lx80nuSijCz7sc3a277R67g,harus bisa lebih bagus lagi watermark bagi android samain sama iphone terus kalo penggunanya bikin harus ada yang like ada yg komen percuma kan buat,3,51,12.3.6,2019-08-09 21:22:13,,,12.3.6
4a0fb5b4-5b3e-484c-80e2-ee0db345bc26,mic hael,https://play-lh.googleusercontent.com/a/ACg8ocLi8pD42qZ9Dt6ckjsXulLKNnLPXt_-LKJLYGmyJZ6tiRkpSw=mo,"Sekarang tiktok kok susah memposting yaa,,setiap aku mau post selalu gagal. Padahal udh instal ulang,,tapi tetap aja gitu. Sekarang tiktok makin aneh aja",3,9,,2020-11-14 07:06:14,,,
5610b737-5b3b-404b-b753-af03c96daf0b,Nurhayati Jambak,https://play-lh.googleusercontent.com/a-/ALV-UjUBgzpL0GVD_a7s6UY__s1gJVtN5d1UIK5RF49CNoPzDm589EEZ,"Aplikasi yg asyik, seru buat hiburan. Mantul Mantap Betul.....",5,92,17.6.41,2020-10-02 20:37:20,Terima kasih untuk dukungannya! Tim pengembangan TikTok akan bekerja keras utk terus meningkatkan kualitas aplikasi ini menjadi lebih baik lagi!,2020-10-23 16:07:52,17.6.41
c31ae30f-9715-4213-90c3-720f196e70b5,Melvin Dean,https://play-lh.googleusercontent.com/a-/ALV-UjU9286gTanxsau8DF2_EnnU78k3uwMkOWb6YqkEOP1_eFnuaFEUgg,"Aplikasi yang bernama tiktok ini bisa membuat aku atau anda menjadi tertawa, senang dan tertawa di saat aku sedih / anda, ayo download aplikasi yang bernama tiktok di play store atau pun di app store, 5 STARS",5,4,,2021-05-13 22:54:11,,,
f719f53e-db87-460a-95c3-d4b0d83fffdb,Mentor_LB9_B_06_Marlina,https://play-lh.googleusercontent.com/a-/ALV-UjX14bdtLOXNLeL4OEdVE0kGI93bKKPUdKNhxwKby93IQbz8tKY_Hg,"bnyk iklan, nge-lag, ga suka font ny, fyp nya ska muncul yg gjelas, lebih suka pke tiktok lite",3,5,,2022-02-13 09:42:05,,,
fe2fe7af-9223-42a5-858d-8c3628025bc9,Afiata,https://play-lh.googleusercontent.com/a-/ALV-UjUWEoXmvG7Zd5QYROrxuoKC4FlSPC3ZPfa-MZNw7bmUaRh-vkcd,"Tolong tiktok tambahkan fitur 18- 18+ ketika saat upload,agar tidak ada anak kecil yang melihat konten 18+",1,7,,2021-02-25 21:12:44,,,
c6ab8a7e-b38b-4294-8ec1-e90fbb829068,Pengguna Google,https://play-lh.googleusercontent.com/EGemoI2NTXmTsBVtJqk8jxF9rh8ApRWfsIMQSt2uE4OcpQqbFu7f7NbTK05lx80nuSijCz7sc3a277R67g,Saya tidak bisa mendownlod apk ini saya sudah menghapus semua foto dan apk yang lain tapi tetap saja tidak bisik saya kasih bintang 1 saja tolong diperbaiki,1,9,,2020-01-26 21:15:04,"Hi, we apologize for any issues with the app and appreciate your feedback. For help with downloading, installing, or opening TikTok, please contact our support team: feedback@tiktok.com",2020-01-27 19:57:40,
c25947fc-36ef-4a57-b068-191ea4d10c5b,Pengguna Google,https://play-lh.googleusercontent.com/EGemoI2NTXmTsBVtJqk8jxF9rh8ApRWfsIMQSt2uE4OcpQqbFu7f7NbTK05lx80nuSijCz7sc3a277R67g,Ini bagus banget bisa di simpan di galeri hasil nya terus bisa di pasang ke ss wa pokok nya bagus deh,5,9,,2019-11-16 22:27:11,,,
96100201-e710-4c35-8881-b1416b10d3e3,Pengguna Google,https://play-lh.googleusercontent.com/EGemoI2NTXmTsBVtJqk8jxF9rh8ApRWfsIMQSt2uE4OcpQqbFu7f7NbTK05lx80nuSijCz7sc3a277R67g,aplikasi tik tok ini setiap di unduh kok gak bisa terpasang ya harus ngunduh berulang ulang kali,1,7,,2019-06-15 16:35:43,,,
25d97755-5fcb-4b8b-a9ee-f75de8ae23e0,Nasywa ophelia,https://play-lh.googleusercontent.com/a-/ALV-UjUCVL6X_pgye1De5tic81I55X5xjFLLtXv_LRu7iIFSud3LoUaH,"Saya sudah mendownload aplikasi ini berulang kali tapi kali ini knp tidak bisa?? Sudah tiga kali saya mencoba dan hasilnya sama, mohon infonya",1,7,,2020-07-11 19:54:50,,,
544570fa-8ed2-46b3-8ab3-eb48857d44bc,Azrah Nita,https://play-lh.googleusercontent.com/a/ACg8ocJdFWdI19xmP8g9ompBAoH7W7E-WosMZvrfj5jtlVNPQVFQYA=mo,Samgat terhibur dengan menggunakan aplikasi ini tapi sayangnya tik tok sebelumnya aku terhapus jd sekarang harus download lagi mudah2an aku bisa menggunakan account lama,5,5,,2020-08-22 13:45:37,,,
15862efe-6f4d-4077-9a24-73cea15039be,Henny Susanti,https://play-lh.googleusercontent.com/a-/ALV-UjXXaJIR881sSUiqyOsAZSEXuZy7nHWOmf4dwgpeNBfn2QClIWg,Aplikasi yang sangaaat bagus dan juga sangat menghibur apalagi kalau kita sedang lagi nggak muut Coco banget liat aplikasi ini pasti di jamin ngakak,5,158,24.1.4,2022-04-21 14:06:39,,,24.1.4
1706900f-1709-44fe-bb45-8434ef5cb52d,Cepy Irawan,https://play-lh.googleusercontent.com/a-/ALV-UjVaSKLnj8CGvZbSJN-Q_85KEvZEk3i_0-vK4SMl8zD7fbEQwoib,Saya kasih bintang 4 app ini sebenarnya bagus tapi saya cuma kasih bintang 4 bukan bintang lima karena ga bisa slowmo yg potong potong gitu deh😌,4,8,,2020-11-25 16:03:08,,,
b91043eb-4eb8-4d4a-b455-5be8a0485447,Pengguna Google,https://play-lh.googleusercontent.com/EGemoI2NTXmTsBVtJqk8jxF9rh8ApRWfsIMQSt2uE4OcpQqbFu7f7NbTK05lx80nuSijCz7sc3a277R67g,Tolong ini slowmo nya tiktok di benerin karna saya udh bagus bagus ehh ke buang sendiri habis itu mau uploud aku udh tunnguin lama tapi malah mohon maaf coba di ulang lagi 🙏😞 itu saja terima kasih,2,9,,2020-04-14 17:39:11,,,
d10727da-74bb-4027-a4cd-55524d16292f,Pengguna Google,https://play-lh.googleusercontent.com/EGemoI2NTXmTsBVtJqk8jxF9rh8ApRWfsIMQSt2uE4OcpQqbFu7f7NbTK05lx80nuSijCz7sc3a277R67g,"Kok gak bisa unduh suara ya, jadi gak ada lagunya kalau mau main tiktok..",2,16,,2020-02-11 10:57:13,,,
576cc3d8-b07e-4258-82b8-b8a692dcda88,Mariam Mariyummy Channel,https://play-lh.googleusercontent.com/a-/ALV-UjXIvSUwQPt--XC9FUsEZqOYzdrt0tYA8ZL2wGLwPlSi70S97qqZ,"Suka banget sama aplikasi ini sangat menghibur dan menyenangkan, semoga semakin berkembang lagi untuk ke depannya",5,265,23.2.5,2022-02-20 00:48:08,,,23.2.5
5f375ac3-0e3c-4531-981b-1dc911d851fb,Usep Prazetyo,https://play-lh.googleusercontent.com/a-/ALV-UjWGTwQQkXg13l9PBqDyvKI3iuClgPSeZNx4oJXucuUK4gP5QyRN,"Tiktok update makain ga nyaman, sekarang sudah ga bisa skip/ percepat video. Tiktok meresahkan",1,300,28.1.3,2023-02-08 08:12:53,,,28.1.3
b46a3179-6e66-4b8b-a5ce-39d2906c810a,martins jaques,https://play-lh.googleusercontent.com/a/ACg8ocIJEFK3Rykm0zXxby5_nAW-_3ilD5xpsW-kPCMyptBrQ_2ugQ=mo,hahahah aplikasi buruk saya udah downlod tapi saya tidak bisa nonton saya sudah dftar kan diri masih sajah enga bisa sagat disayangkan .... tolong di perbaiki...klo udah perbaiki saya kasi 5bintang,1,84,18.1.3,2020-12-21 14:53:05,,,18.1.3
af3079e2-3120-4f73-b84d-6d73961ceaed,Sony Bandung,https://play-lh.googleusercontent.com/a/ACg8ocLIy8GXKvDOL13rR2jtqB17H6QVXj6laD-KfeEUORCkRBn1iw=mo,"Aplikasi Tiktok ini bgs, tapi syg waktu live tmn tdk bisa lht org yg live hanya bisa komentar ja yg bisa di lht..",5,191,26.5.5,2022-10-22 13:47:52,,,26.5.5
05ea49b9-2106-4730-822e-0f3088b03586,FEBTI TITA INTERNATIONAL,https://play-lh.googleusercontent.com/a-/ALV-UjVV1g4m6KW6uMWQ_b50wR7rp_vB1hMJ01R-yPi-SO_DlKtbyNA,Asli nya sih Baik baik aja tapi kenapa saya tidak bisa mengirim pesan sedangakn yg lain bisa Untuk tiktok minta tolong di perbaiki,1,8,4.9.0,2020-07-21 13:11:09,,,4.9.0
651404b5-25db-42a6-aab6-38b0ea3f3965,Evita Vidia,https://play-lh.googleusercontent.com/a-/ALV-UjVyD1-QOv5UIw5MBbrxtsemt_wbnjXSOdeiTbcS45mrz-l9Akra,Tik tok emang kren tapi knp aku gk bisa daftar ya? Kalo aku daftar ada tulisan sepertinya anda tidak memenuhi syarat dari tik tok,3,6,,2022-04-25 15:52:05,,,
b171496a-21b4-42ad-9b82-3ca756c00f4d,Fredi Ferdiansyah,https://play-lh.googleusercontent.com/a-/ALV-UjXwcF-_SSZRI9fveRHIdiiusXZjZAB-eY6_UtZEfZ86jxooeBY,Menambah wawasan juga pengetahuan yg kita sendiri belum tahu dan juga mengenal berita di negara luar selain di negara sendiri,5,142,22.9.5,2022-01-24 00:26:33,,,22.9.5
9387a9cb-ba5a-4e9a-9d27-63bae655ee8f,Pengguna Google,https://play-lh.googleusercontent.com/EGemoI2NTXmTsBVtJqk8jxF9rh8ApRWfsIMQSt2uE4OcpQqbFu7f7NbTK05lx80nuSijCz7sc3a277R67g,ini apk nya udh di download kok gk bisa yh malah disuruh download ulg lagi sia² ajh nih pdhl tdi udh menginstal eh kok di layar utma hp gue gk ada.lngsng cek ke plystore yh ngulang deh knp gitu gan!!,1,294,11.2.1,2019-06-08 18:04:15,,,11.2.1
b1226936-2326-40fb-b37b-c3e5b3b5379d,Terima apa gak Najmahsalma,https://play-lh.googleusercontent.com/a-/ALV-UjUbE9VBsaezrCdhDzHjsgCpfObpFJ4zXr1ZlFdbZ7B3fOmurgda,Jelek ko da banyak tiktok bingung milih dah ini aplikasi asli / palsu bingung nggak lagi deh donload s sekarang baru tau kan yang asli ribeeeeet,1,3,,2021-07-30 17:07:51,,,
0155b3b2-8b4e-4762-85f0-a2037519c5a7,Ega Irna,https://play-lh.googleusercontent.com/a/ACg8ocKihQgPVZSSg2BB3B938SgFQEFq5qys-kfDyfHNMRakYhbe=mo,"mantap apkisi nya,,terimakasih smoga ke depan nya makin ada fitur dan filter"" baru lagi !!!!!!!!!!!!!!!!!!!!!!!!!¡!!!!!!!!!the best",5,318,21.5.6,2021-10-11 17:27:46,,,21.5.6
294d81d5-2334-4300-a59d-8a9703bbc291,Ikaarti,https://play-lh.googleusercontent.com/a-/ALV-UjWE-lq6vzfAehR3Cqb43ZhacJqJjvmlSWiGTllk8rHY1ZkrGeak,"Aplikasi yang dulu nya dibilang alay, sekarang menjadi aplikasi paling populer saat ini. Emang gak ada yang tahu masa depan",4,4,,2021-08-13 18:41:02,,,
9ab05ef3-6e5b-453d-8a34-88ca4c5b8a85,abun vong,https://play-lh.googleusercontent.com/a/ACg8ocLbl3LUI7iyW1Kp93V0sL7fNAnFytawGuawIFBdj5X5EWcmNw=mo,Sayan suka sekali sama tik tok ini karena bisa bikin video dan bisa di simpan dan bisa di bagi ke teman teman seruh deh,5,4,,2023-03-13 14:43:36,,,
9313c6bc-15ff-4647-a29b-e27dc9638e8b,Aryangga Reynaldi Danuartha,https://play-lh.googleusercontent.com/a-/ALV-UjWztOUpDRe5lsAF_90c8g14enpz_IumFoYTSeHoGeYmRqO4igOV,"Terima kasih tiktok, apk yg bagus bisa liat kayes joged"" dan cewek lainya, live streaming nya juga mantap mantap kurangan mereka pakek BH aja tiktok terima kasih ya ....",5,255,19.9.4,2021-06-18 11:37:30,,,19.9.4
1c5a4553-c2d9-4d33-9b20-4c3ea3676b68,Tere Radiska,https://play-lh.googleusercontent.com/a-/ALV-UjVLNZ6Gy3qFVgoehiHnw7oKUGO3egQlsiujynV4JCgvogYUcjc,"aplikasi yang sangat bermanfaat, semoga makin sukses dan berkah selalu. Terimakasih tiktok 🥰",5,20,27.4.5,2023-04-15 01:25:38,,,27.4.5
cb9e181a-327d-43ad-9b4b-29614abc829f,Bocil Sultan,https://play-lh.googleusercontent.com/a/ACg8ocIYngvDXlBW9tL7k2bcAAfy6T1-a8SeaBUOvA40knZop5ee3w=mo,"akun di kunci udah kirim data data akunya tidak pernah di urus, paling di bls email suruh kirim data mulu padahal udah kecewaa bgt",1,5,,2022-04-22 05:54:33,,,
28e0ecc6-9ccf-41d5-890d-cd4270b0ee9f,Rafi Freefire,https://play-lh.googleusercontent.com/a/ACg8ocIcv14wR7lYpDdQl5djvHGf9w-UXwzJz2Yzyk0fhLwHYPznOA=mo,"Wow😯apk ini sangat bagus,kepada pihak Garena bisa di tingkatkan lagi,selebihnya bagus sih moonton,memang mantap lah Tencent 👍🏼",1,452,19.1.3,2021-04-21 03:34:29,,,19.1.3
8568a8c8-1f74-4c14-9f42-9f0619ed4bdc,Kim Rahman,https://play-lh.googleusercontent.com/a/ACg8ocIxzmAr7Y9L4Ja-2oyZQGm8lhrroyUnVN9LkUqvUmH3zjXxVQ=mo,"Kenapa nggak bisa live 9 Komal?? Kok yang lain bisa? Kenapa kita nggak bisa, ayolah update ke 9 Komal please",3,44,28.8.3,2023-03-29 00:06:02,,,28.8.3
659ffae1-5a88-48fe-ab26-dae983202e32,Putri Zahra,https://play-lh.googleusercontent.com/a/ACg8ocJBoSlJyiQIR8J4WdgBv1N-MrfqukPslIH5g4mVZuSciLJa8Q=mo,"Tolong dong jangan macet lagi,ga bisa bikin vt ga bisa edit profil juga kenapa sih",3,58,18.7.41,2021-03-23 18:06:31,,,18.7.41
87ecbd75-851d-44a1-801c-764fdb11bfad,Edy Susanto,https://play-lh.googleusercontent.com/a-/ALV-UjV4_6JD_HsSG5h0K3_pc-bZPixPJuJ1egIC9RgLkOp0RuOvbAZc-g,"Aplikasi gak mutu main blok aja... unistall, males bikin account baru. gue bikin cuma buat awasi anak. fix satu keluarga unistall gak butuh tiktok. yg bilang kalian dpt coin jng percaya diboongin, coin gue ilang sendiri",1,7,6.6.0,2021-07-23 19:54:16,,,6.6.0
41d3986d-9d2c-47f1-9c73-395d5744df60,Deco Rizio,https://play-lh.googleusercontent.com/a/ACg8ocL4pRT9IEfyTe-6MxC9olJqkSlXbGjJm2fdPwCzwz5o3coQNg=mo,Kenapa video saat di refresh videonya gak bisa yang lain terus ajah yang ada.,1,12,,2022-06-04 12:13:18,,,
db37b15c-8f6b-4b87-8c45-97b75921a746,Anis Clack,https://play-lh.googleusercontent.com/a/ACg8ocIsKyb-kdtqt02hzq5FkpjU3gaSivc3byG0CY8l0NH8iW82fg=mo,Gk bagus banget app ini Masah Sih akun saya di blokir kan saya gk ngapa ngapain saya kesel banget saya udah daftar berkali Kali Tapi gk Ada hasil nia mohon di perbaiki app ini Karna saya Juga ingin bermain Tik Tok Seperti orang lain Juga💔💔💔💔💔,1,248,25.7.7,2022-08-19 17:55:31,,,25.7.7
0270644c-2c7d-4772-9998-94270e9a0565,Pengguna Google,https://play-lh.googleusercontent.com/EGemoI2NTXmTsBVtJqk8jxF9rh8ApRWfsIMQSt2uE4OcpQqbFu7f7NbTK05lx80nuSijCz7sc3a277R67g,Hai perkenalkan nama saya hasna aulia aku suka bangt tik tok😍 kalian langsung donwlod aplikasi tik tok gak akan nyesel deh kalian bisa menggunakan aplikasi tik tok dengan bersenang senag terimakasih aplikasi tik tok,5,7,,2020-03-20 15:38:04,,,
e233179e-5f79-4176-a0a6-d846ec90603d,Feldiano Ximenes,https://play-lh.googleusercontent.com/a/ACg8ocIq4Q4wX89clsu4qW_7UX2h1R5pJaYjgTQTQWuARn_n1RXWpg=mo,Aplikasinya bagus banget dan bisa membuat orang banyak bisa menunjukkan bakat mereka masing-masing di Tik Tok,5,13,,2022-04-21 17:36:44,,,
6b75011f-3abc-4303-8cf5-e3932ade493d,Kafka Bilal Aidan,https://play-lh.googleusercontent.com/a-/ALV-UjX-oCs1zji9fZWs7tPcj1KsKvF3rEXb-Oi96uDW2Z8G7dZ0uQH9xQ,aplikasi ini sangat menghibur. Tetap maju kan program baru di tik tok..............,5,94,18.7.5,2021-03-16 21:49:26,,,18.7.5
233011b7-dc34-430d-a331-7f57e09086f8,Raya putry Puput,https://play-lh.googleusercontent.com/a/ACg8ocI0vV42tIMxS8ivw614PoJv8bouiqDkUIAqQ5CZoZjZhWBotQ=mo,"Aplikasi tiktok saya terhapus, trus saya coba mendownload lagi, enggak bisa gimna caranya yah😞",5,78,,2021-10-20 07:28:56,,,
5e6cd09c-b255-4705-ba65-971f7e6780fe,Pengguna Google,https://play-lh.googleusercontent.com/EGemoI2NTXmTsBVtJqk8jxF9rh8ApRWfsIMQSt2uE4OcpQqbFu7f7NbTK05lx80nuSijCz7sc3a277R67g,"Dengan hormat kepada pihak Musical.ly saya kecewa dengan adanya pembaruan ini,mungkin bukan saya aja yang kecewa dengan adanya pembaruan ini,kami mohon maaf sekali,apakah musical.ly bisa dikembalikan?,maaf bila ada salah"" kata😊",2,45,8.6.0,2018-10-12 06:29:41,,,8.6.0
c8a32a2f-c49b-4bc3-be19-5550c2f535a0,Alwan officiall,https://play-lh.googleusercontent.com/a-/ALV-UjVP_J5And2Qs_FIwFwr6FCfd9velD4NgK8xl78tCm7R7GIe_R_o,"Bagusi tapi ngedonload nya lama tapi kalo nanti nanti cuma sebentar aku kasih 5,sama lagi udah 24 mnt kok masih 11,padahal jaringan bagus☹😣😖😫😩❌❌❌",1,10,,2020-07-07 11:07:53,,,
b26475ef-10e7-440d-a608-be44d1b0b275,Pengguna Google,https://play-lh.googleusercontent.com/EGemoI2NTXmTsBVtJqk8jxF9rh8ApRWfsIMQSt2uE4OcpQqbFu7f7NbTK05lx80nuSijCz7sc3a277R67g,"bagus sih!!tapi hampir semua lagu india,dj nya cuma sedikit tolong diperbaiki",4,14,,2019-03-02 16:05:05,,,
8963be5d-e04c-4e03-a566-48bb47a5d492,Pengguna Google,https://play-lh.googleusercontent.com/EGemoI2NTXmTsBVtJqk8jxF9rh8ApRWfsIMQSt2uE4OcpQqbFu7f7NbTK05lx80nuSijCz7sc3a277R67g,"Saya lebih memilih musical.ly yg dulu!plis deh gosah di campur2,Tik tok di campur musical.ly mau jadi apa?plis kembalikan musical kami yg dulu bukan yg skrg!'_'",1,12,,2018-09-28 12:25:28,,,
eb1046d4-d535-4058-8340-6d6ec3412c50,Pengguna Google,https://play-lh.googleusercontent.com/EGemoI2NTXmTsBVtJqk8jxF9rh8ApRWfsIMQSt2uE4OcpQqbFu7f7NbTK05lx80nuSijCz7sc3a277R67g,Bagus sih aplikasinya.tp terkadang kena blok padahal ga ada yg melanggar.tp yg keliatan cd nya sam tetek aman,5,9,5.7.0,2018-11-16 22:46:45,,,5.7.0
